<?xml version="1.0" encoding="UTF-8"?>
<retailOutlets xmlns="http://www.solms.co.za/retail/outlets"
    xmlns:xsi="http://www.w3.org/2001/XMLSchema-instance"
    xsi:schemaLocation="http://www.solms.co.za/retail/outlets ./retailOutlets.xsd">
    
    <retailOutlet id="out1">
        <name>Soul Flutes</name>
        <address>12 Groovy Rd, Jazz Town</address>
        <region>Deep South</region>
    </retailOutlet>
    
    <retailOutlet id="out2">
        <name>Chanting Drums</name>
        <address>7 Rhythm ave, Beat Town</address>
        <region>Far West</region>
    </retailOutlet>
    
    <retailOutlet id="out3">
        <name>His Master's Voice</name>
        <address>13 Armstrong Ave, Freedom Town</address>
        <region>Deep South</region>
    </retailOutlet>
    
    <region id="Deep South">
        <name>South Border</name>
        <description>Below the mellow river</description>
    </region>
    
    <region id="Far West">
        <name>West Coast</name>
        <description>Behind the spooky forest</description>
    </region>
</retailOutlets>
